{
  "$schema": "../../schemas/preset.schema.json",
  "organization": {
    "fixture": "wonka-confections",
    "planType": "teams-annually",
    "seats": 25
  },
  "users": {
    "count": 25,
    "realisticStatusMix": true
  },
  "groups": {
    "count": 8
  },
  "collections": {
    "count": 15
  },
  "folders": true,
  "ciphers": {
    "count": 250,
    "assignFolders": true
  },
  "personalCiphers": {
    "countPerUser": 25
  }
}
